"ID","Titulo","Ano","RandomForest","SVM","NeuralNetwork","MachineLearning","DataMining","NLP","Ethnography","Interview","Participatory","Observation","CaseStudy","TraditionalKnowledge","Ethnobotany","Indigenous","CulturalKnowledge","TraditionalPractices","Agroecology","Biodiversity","Conservation","FoodSecurity","ClimateChange","Documentation","SpatialAnalysis","Assessment","Management","Developing","Africa","Asia","LatinAmerica","Cluster_KMeans","Cluster_Hierarquico"
269,"Complementarity of scientific analysis and ancestral knowledge systems for diversification of food sources: A case study of pandanus from jiwaka province, Papua New Guinea",2023,0,0,0,1,0,0,0,0,0,0,1,1,0,1,1,0,0,0,1,1,0,0,0,1,0,0,0,0,0,4,2
270,"The status and perception of medicinal plants by local population of Adrar province (Northern Mauritania)",2023,0,0,0,1,0,0,0,1,0,0,0,0,1,0,0,1,0,0,1,0,0,0,0,1,1,0,0,0,0,3,2
271,"Ethnobotanical study of Makra Hills district Muzaffarabad, Azad Jammu and Kashmir, Pakistan",2023,0,0,0,1,0,0,0,1,0,0,0,1,1,1,0,0,0,1,1,0,0,0,0,1,1,0,0,0,0,3,1
272,"Local Soil Classification System As A Tool For Transferring Agricultural Technology In Developing Rural Areas",2023,0,0,0,1,0,0,1,1,0,0,0,1,0,0,0,0,0,0,1,0,0,0,0,1,0,1,0,0,0,2,1
273,"Patagonian Ethnopedology and Its Role in Food Security: A Case Study of Rural Communities in Arid Environments of Argentina",2023,0,0,0,1,0,0,0,0,0,0,1,1,0,0,0,0,0,0,1,1,0,0,0,1,1,1,0,0,0,4,1
274,"Yeknemilis: Social Learning and Intercultural Transdisciplinary Collaboration for Sustainable Life",2023,0,0,0,1,0,0,0,1,1,1,0,1,0,1,0,0,0,0,1,0,0,0,0,0,0,0,0,0,1,3,1
276,"Exploring the viability of ChatGPT as an alternative to traditional chatbot systems in library and information centers",2023,0,0,0,0,0,0,1,1,0,0,0,1,0,1,0,0,0,0,0,0,0,0,0,1,0,0,0,0,0,5,1
277,"Traditional knowledge and use of wild mushrooms with biocultural importance in the Mazatec culture in Oaxaca, Mexico, cradle of the ethnomycology",2023,0,0,0,1,0,0,0,1,0,0,0,1,0,1,0,0,0,0,1,0,0,0,0,1,0,0,0,0,1,2,1
278,"Ethnopharmacological survey of endemic plants used in ethnomedicinal knowledge of Soqotra Island",2023,0,0,0,1,0,0,0,1,0,1,0,1,1,1,0,1,0,1,1,0,0,1,1,1,1,0,0,0,0,3,2
279,"Study protocol: Peer delivered early intervention (Learning through Everyday Activities with Parents for Infants at risk of Cerebral Palsy: LEAP-CP) for First Nation Australian infants at high risk of cerebral palsy - An RCT study",2023,0,0,0,1,0,0,0,1,1,0,0,0,0,1,0,0,0,0,0,1,0,0,0,1,0,0,0,0,0,2,2
280,"Ethnobotany and Wood Anatomy of Banisteriopsis caapi Ethnotaxa and Diplopterys cf. pubipetala, Components of Ayahuasca in Brazilian Rituals",2023,0,0,1,1,0,0,0,1,0,0,0,0,1,1,0,0,0,0,0,0,0,0,0,1,0,0,0,0,1,2,1
281,"School readiness of children at high risk of cerebral palsy r andomised to early neuroprotection and neurorehabilitation: protocol for a follow-up study of participants from four randomised clinical trials",2023,0,0,0,1,0,0,0,1,0,0,0,0,0,1,0,0,0,0,0,1,0,0,0,1,1,1,1,1,0,3,2
282,"Diversity of medicinal plants and their therapeutic usages of Kachin people (Jinghpaw) in the central part of Kachin State, Myanmar",2023,0,0,0,1,0,0,0,1,0,0,0,1,1,0,0,1,0,0,0,0,0,1,0,1,0,1,0,0,0,2,2
283,"Ethnobotanical study of traditionally used plants in the municipality of Zavidovići, BiH",2023,0,0,0,1,0,0,0,1,0,0,0,1,1,1,0,1,0,0,1,0,0,0,0,1,0,0,0,0,1,2,1
284,"Spatial Distribution Characteristics and Driving Factors for Traditional Villages in Areas of China Based on GWR Modeling and Geodetector: A Case Study of the Awa Mountain Area",2023,0,0,0,1,0,0,0,0,0,0,1,1,0,0,0,0,0,0,0,0,0,0,1,1,0,1,0,1,0,4,1
285,"Implementing artificial intelligence in Canadian primary care: Barriers and strategies identified through a national deliberative dialogue",2023,0,0,0,1,0,0,1,0,1,0,0,0,0,1,0,0,0,0,0,0,0,0,0,1,0,0,0,0,0,4,1
286,"Taiga Landscape Degradation Evidenced by Indigenous Observations and Remote Sensing",2023,0,0,0,1,0,0,0,1,0,1,0,0,0,1,0,0,0,0,0,0,0,0,1,1,1,1,0,1,0,3,1
287,"Application of ethnobotanical indices for ethnopharmacology and ethnobotany of the family Lamiaceae used by population in National Talassemtane Park (North of Morocco)",2023,0,0,0,1,0,0,0,1,0,0,0,1,1,0,0,0,0,0,1,0,0,0,0,1,1,0,0,0,0,3,1
288,"A systems approach framework for evaluating tree restoration interventions for social and ecological outcomes in rural tropical landscapes",2023,0,0,0,0,0,0,0,0,0,0,1,1,0,0,0,0,0,1,1,0,0,0,1,1,1,1,1,0,0,5,1
289,"Settling ‘Dagga’? Shifting Frontiers of Cannabis Knowledge and Governance in South Africa",2023,0,0,0,1,0,0,0,0,0,0,1,1,0,0,0,0,0,0,0,0,0,0,0,1,0,0,1,1,0,4,1
291,"""And then Evo appeared…"". Transnational Politics and Indigenous Recognition in Greater Buenos Aires; “Y después apareció Evo…”. Política transnacional y reconocimiento indígena en el Gran Buenos Aires",2023,0,0,0,1,0,0,1,1,0,0,0,0,0,1,0,0,0,0,0,0,0,0,0,0,0,0,0,0,0,2,1
292,"Ethical Issues from Decolonial Practices in Knowledge Organization: The Case of Indigenous Collections in Världskulturmuseet",2023,0,0,0,1,0,0,0,1,0,0,1,0,0,1,0,0,0,0,0,0,0,1,0,1,0,0,0,0,0,4,1
293,"Capturing and Digitization of Indigenous Knowledge in Support of Community Resilience to Climate Change",2023,0,0,0,1,0,0,0,1,1,0,1,1,0,1,0,0,0,1,1,0,1,0,0,1,1,1,0,1,0,3,1
294,"Integrating Technology, Local Knowledge, and Participatory Approach: Real-time Detection System for Mitigating Human-Animal Conflicts in Rural India",2023,0,0,0,1,0,0,0,0,1,0,1,1,0,0,0,0,0,0,1,0,0,0,0,1,1,1,0,1,0,4,1
295,"Characterization and Biocultural Importance of the Agroforestry Systems of the Sierra de Huautla Biosphere Reserve, Morelos, Mexico; Caracterización e importancia biocultural de los sistemas agroforestales de la Reserva de la Biósfera Sierra de Huautla, Morelos, México",2023,0,0,0,1,0,0,0,1,0,0,0,0,1,0,0,0,0,0,1,0,0,0,0,1,1,1,0,0,1,3,1
296,"In Consideration of Indigenous Data Sovereignty: Data Mining as a Colonial Practice",2023,0,0,0,1,1,0,0,0,0,0,1,1,0,1,0,0,0,0,0,0,0,0,0,0,0,0,0,0,0,4,3
297,"Local knowledge of bird species and socio-economic, cultural, and ecological functions of birds and their various disturbances in the rural ecosystem of the Cisokan Watershed, West Java",2023,0,0,0,1,0,0,1,0,0,0,0,1,0,0,0,0,0,0,0,0,0,0,0,1,0,1,0,0,0,4,1
298,"Traditional Use of Biodiversity for Nutrition and Health in the Americas: A Case Study from Mexico",2023,0,0,0,1,0,0,0,0,0,0,1,1,1,1,0,1,0,1,0,1,0,0,0,1,1,1,0,0,1,3,2
299,"Co-Design Disaster Management Chatbot with Indigenous Communities",2023,0,0,0,1,0,0,1,1,0,0,0,0,0,1,0,0,0,0,1,0,1,1,0,1,1,0,0,0,0,4,1
300,"Conclusion: Design Strategies for Eco-cultural Cities",2023,0,0,0,1,0,0,1,0,0,0,0,1,0,1,0,0,0,0,1,0,0,0,0,0,1,0,0,0,0,4,1
301,"Gastronomic ethnobotany of traditional vegetables among the Sundanese in rural West Java, Indonesia",2023,0,0,0,1,0,0,1,0,0,0,0,1,1,0,0,0,0,0,0,0,0,0,0,1,0,1,0,1,0,2,2
302,"From Knowledge Management to Intelligence Engineering - A practical approach to building AI inside the law-firm using open-source Large Language Models",2023,0,0,0,1,0,1,1,0,0,0,0,1,0,0,0,0,0,0,0,0,0,0,0,1,1,0,0,0,0,4,3
303,"Ethnopedological knowledge of upland Karbi Community: A case study from Dima Hasao District of Assam, North-Eastern Himalaya, India",2023,0,0,0,1,0,0,0,1,0,0,1,1,0,1,0,0,1,0,0,0,0,1,0,1,0,0,0,1,0,4,1
304,"Management of Water Resources and Health Promotion in Drought: An Indigenous Knowledge-Based Qualitative Study",2023,0,0,0,1,0,0,1,0,0,0,0,1,0,1,0,0,0,0,1,0,0,0,0,1,1,1,0,0,0,4,1
305,"A conceptual framework for assessing farmers’ soil knowledge: lessons from the Lake Alaotra Region in Madagascar; Un cadre conceptuel d’évaluation des connaissances paysannes sur les sols: leçons tirées de la région du Lac Alaotra, Madagascar",2023,0,0,0,1,0,0,0,1,1,0,0,0,0,0,0,0,0,0,1,0,0,0,1,1,0,1,0,0,0,3,1
306,"Understanding the mountainscape dynamics and its drivers using geospatial technology and indigenous knowledge in the Ado-Awaye Mountains, Nigeria",2023,0,0,0,1,0,0,0,1,0,0,0,1,0,1,0,0,0,0,0,0,0,0,1,1,0,0,0,0,0,2,1
307,"Depression Detection in Speech Using Transformer and Parallel Convolutional Neural Networks",2023,0,0,1,0,0,0,0,1,0,0,0,1,0,0,0,0,0,0,0,0,0,0,0,1,0,0,0,0,0,5,1
308,"Indigenous experiences and perspectives on a mining corporation's community relations and development activities",2023,0,0,0,1,0,0,1,1,0,1,0,0,0,1,0,0,0,0,0,0,0,0,0,1,0,0,0,1,1,2,1
311,"The Sociocultural Construction of Soil among Communities of the Bolivian Altiplano: Potential for Supporting Transitions to Sustainability",2022,0,0,0,1,0,0,0,1,1,0,0,1,0,1,0,0,0,0,1,0,0,1,1,0,1,0,0,0,0,3,1
313,"Coproduction mechanisms to weave Indigenous knowledge, artificial intelligence, and technical data to enable Indigenous-led adaptive decision making: lessons from Australia’s joint managed Kakadu National Park",2022,0,0,0,1,0,0,1,1,0,0,0,1,0,1,0,0,0,0,0,0,0,0,0,1,1,0,0,0,0,4,1
314,"Farmers’ knowledge, practices and use of sesame genetic resources in the production systems of Benin: case study of agro-ecological zone IV",2022,0,0,0,1,0,0,0,1,0,0,1,1,0,0,0,0,0,0,0,0,0,0,0,1,1,1,1,0,0,4,2
315,"Morphological variability of Euphorbia sepium N.E. Br. across the Sudanian and Sudano-Guinean zones of Benin Republic (West Africa): Implications for conservation",2022,0,0,0,1,0,0,1,0,0,0,0,0,1,0,0,0,0,0,1,0,0,0,0,1,1,0,1,0,0,3,2
316,"Cultural and ethnobotanical legacy of native potatoes in Colombia",2022,0,0,0,1,0,0,0,1,0,0,0,1,1,1,0,0,0,0,1,1,0,1,0,1,1,0,0,0,1,3,2
317,"Indigenous Biosystematics of Enset (Ensete ventricosum [Welw.] Cheesman) in its Center of Origin and Diversity, Southwest Ethiopia: Folk Nomenclature, Classification, and Descriptors",2022,0,0,0,1,0,0,0,1,1,1,0,1,1,1,0,0,0,0,1,1,0,0,0,1,1,0,1,0,0,3,2
318,"Spatial use of marine resources in a rural village: A case study from Qoma, Fiji",2022,0,0,0,1,0,0,1,0,1,0,1,1,0,1,0,0,0,0,1,0,0,0,1,1,1,1,0,0,0,4,1
319,"An Ethnobotanical study of medicinal plants in Taşköprü (Kastamonu–Turkey)",2022,0,0,0,1,0,0,0,1,0,0,0,1,1,0,0,1,0,0,0,0,0,0,0,1,0,1,0,1,0,2,2
320,"“I'm really happy when sometimes I end up on a shelf that seems sort of right:” Historians' Reactions to the Cataloging and Classification of their Own Work",2022,0,0,0,1,0,0,1,1,0,0,0,0,0,1,1,0,0,0,0,0,0,0,0,1,0,0,0,0,0,2,2
321,"Ethnopharmacological preparations used for digestive system disorders by the population in Talassemtane National Park (North of Morocco)",2022,0,0,0,1,0,0,0,1,0,0,0,0,1,0,0,0,0,0,1,0,0,0,0,1,0,0,0,0,0,2,1
322,"Clustering of chronic disease risks among people accessing community mental health services",2022,0,0,0,1,0,0,0,1,0,0,0,0,0,1,0,0,0,0,0,0,0,0,0,1,0,0,0,0,0,2,1
323,"Climate change perception and local adaptation of natural resource management in a farming community of Cameroon: A case study",2022,0,0,0,1,0,0,0,1,0,1,1,0,0,0,0,0,0,0,0,0,1,0,0,1,1,0,0,0,0,4,1
324,"Polynesian medicine used to treat diarrhea and ciguatera: An ethnobotanical survey in six islands from French Polynesia",2022,0,0,0,1,0,0,0,1,0,0,0,0,1,0,0,1,0,0,1,0,0,0,1,1,0,0,0,1,0,2,2
327,"“Spider Monkey Cotton”: Bridging Waiwai and Scientific Ontologies to Characterize Spider Monkey (Ateles paniscus) Filariasis in the Konashen Community Owned Conservation Area, Guyana",2022,0,0,0,1,0,0,1,0,0,0,0,0,0,1,0,0,0,0,1,0,0,0,0,1,1,0,0,0,0,4,1
328,"Ethnobotanical study of plants used by the Munda ethnic group living around the Sundarbans, the world's largest mangrove forest in southwestern Bangladesh",2022,0,0,0,1,0,0,0,1,0,1,0,1,1,1,0,1,0,1,1,0,1,1,0,1,1,0,0,0,0,3,2
329,"Catharanthus roseus (L.) G. Don: A review of its ethnobotany, phytochemistry, ethnopharmacology and toxicities",2022,0,0,0,1,0,0,1,0,0,0,0,0,1,0,0,1,0,0,0,0,0,0,1,1,0,0,0,0,0,2,2
330,"Indigenous knowledge and quantitative ethnobotany of the Tanawal area, Lesser Western Himalayas, Pakistan",2022,0,0,0,1,0,0,0,1,1,0,0,1,1,1,0,1,0,0,1,0,0,0,1,1,1,1,0,0,0,3,1
331,"Perception of malaria and cultural diversity of antimalarial plants in three sympatric communities: Agni, Akyé and Gwa in the District of Alépé, Côte d’Ivoire",2022,0,0,0,1,0,0,0,1,0,0,0,0,1,0,0,0,0,0,0,0,0,0,1,1,0,1,0,0,0,2,1
333,"The Social Lives of Plants and People: Indigenous Traditional Ecological Knowledge and Food Practices in Amis Home Gardens; 人與植物的社會生命： 阿美族菜園裡的原住民傳統生態知識及飲食實踐",2022,0,0,0,1,0,0,1,1,0,1,0,1,1,1,0,0,0,0,0,0,1,0,0,1,0,0,0,0,0,2,1
334,"Contextualising Aboriginal faunal stories with the Linnaean taxonomy: Culturally responsive pedagogy in zoology",2022,0,0,0,1,0,0,0,1,1,0,0,0,0,1,0,0,0,0,0,0,0,0,0,0,0,0,0,0,0,2,1
335,"Comparison of techno-economic optimisation models for rural hybrid microgrid design",2022,0,0,0,1,0,0,0,0,0,0,1,0,0,1,0,0,0,0,0,0,0,0,0,1,0,1,0,0,0,4,1
336,"Properties and indigenous knowledge of soil materials used for consumption, healing and cosmetics in KwaZulu-Natal, South Africa",2022,0,0,0,1,0,0,1,1,0,0,0,1,0,1,0,0,0,0,1,0,0,0,0,1,1,1,1,0,0,3,2
337,"Indigenous Knowledge of Shepherds in Determining the Flammability of Vegetation: A case study of Khalkhal Semi-Steppic Rangelands of Iran; دانش بومی شبانان در تعیین آتشپذیری گیاهان: مطالعه موردی مراتع نیمه استپی خلخال ایران",2022,0,0,0,1,0,0,0,1,1,0,1,1,0,1,0,0,0,0,0,0,0,0,0,1,1,0,0,0,0,4,1
339,"Prioritizing the People: Developing a Method for Evaluating a Collection’s Description of Diverse Populations",2022,0,0,0,1,0,0,0,0,0,0,0,0,0,1,0,0,0,0,0,0,0,0,0,0,0,1,1,0,0,4,1
340,"‘Among predators’: the place of humans, Iberian lynx and other wild carnivores; “Entre predadores”: o lugar dos humanos, do lince ibérico e de outros carnívoros selvagens",2022,0,0,0,1,0,0,0,1,0,1,1,0,0,0,0,0,0,0,1,0,0,0,0,1,1,1,0,0,0,3,1
341,"Khakass Underground and Semi-Underground Dwellings: Problems of Studying and Typology; Подземные и полуподземные жилища хакасов: проблемы изучения и типологии",2022,0,0,0,1,0,0,1,0,0,0,0,0,0,1,0,0,0,0,0,0,0,0,1,1,0,0,0,0,0,4,1
342,"The subalpine and alpine vegetation of the Georgian Caucasus-a first ethnobotanical and phytosociological synopsis",2022,0,0,0,1,0,0,0,1,0,0,0,1,1,1,0,0,0,1,0,0,0,0,1,1,0,0,0,0,1,2,1
343,"‘Things of the outside teach me’: identity transfer and contextual transformation as expressions of persistent, syncretic cosmology in traditional spiritual and medicinal practice in the south-central Maloti-Drakensberg, southern Africa",2022,0,0,0,1,0,0,0,1,0,0,0,0,0,0,0,0,0,0,0,0,0,0,0,0,0,0,1,0,0,2,1
344,"TRADITIONAL ECOLOGICAL KNOWLEDGE OF BIRDS INHABITING SAN ANDRES DE LA CAL, TEPOZTLAN, MORELOS, MEXICO; CONOCIMIENTO ECOLÓGICO TRADICIONAL DE LAS AVES DE SAN ANDRÉS DE LA CAL, TEPOZTLÁN, MORELOS, MÉXICO †",2022,0,0,0,1,0,0,0,1,0,0,0,1,0,1,0,0,0,0,1,0,0,0,0,1,1,0,0,0,1,3,1
345,"Classifying Soils: Points of Convergence in Indigenous Knowledge Engagement with Scientific Epistemologies",2022,0,0,0,1,0,0,1,0,0,0,0,1,0,1,0,0,0,0,0,0,0,0,0,0,1,0,1,0,0,4,1
346,"Smart Knowledge Engineering for Cognitive Systems: A Brief Overview",2022,0,0,1,1,0,0,0,0,0,0,1,1,0,0,0,0,0,0,0,0,0,0,0,1,1,0,0,0,0,4,1
347,"Bim machine learning and design rules to improve the assembly time in steel construction projects",2022,0,0,0,1,0,0,0,1,0,0,1,1,0,1,0,0,0,0,0,0,0,0,0,1,0,0,0,0,0,4,1
348,"Do algorithms have a right to the city? Waze and algorithmic spatiality",2022,0,0,0,1,0,0,0,0,0,0,1,1,0,0,0,0,0,0,0,0,0,0,1,1,0,1,0,0,0,4,1
349,"Real-world﻿ artificial intelligence-based opportunistic screening for diabetic retinopathy in endocrinology and indigenous healthcare settings in Australia",2021,0,0,0,1,0,0,0,1,0,1,0,0,0,1,0,1,0,0,0,0,0,0,0,1,0,0,0,0,0,2,1
350,"A historical and ethnobotanical study on local botanical knowledge recorded in the book “Mongolia and Amdo and the Dead City of Khara-Khoto”",2021,0,0,0,1,0,0,0,1,0,0,0,1,1,1,0,0,0,0,0,0,0,0,0,1,0,0,0,1,0,2,2
351,"Ethnobiological study on traditional medicinal plants and fungi recorded in the Naxi Dongba sutras",2021,0,0,0,1,0,0,0,1,0,0,0,1,1,0,0,1,0,0,1,0,0,0,0,1,1,0,0,1,0,3,2
352,"Breaking the paradigms of residual categories and neglectable importance of non-used resources: the “vital” traditional knowledge of non-edible mushrooms and their substantive cultural significance",2021,0,0,0,1,0,0,1,1,0,0,0,1,0,0,0,0,0,0,0,0,0,0,0,1,0,0,0,0,1,2,1
353,"Traditional food plants of the upper Aswa River catchment of northern Uganda—a cultural crossroads",2021,0,0,0,1,0,0,0,1,1,0,0,0,1,1,0,0,0,1,0,1,0,0,0,1,1,1,1,0,0,3,2
354,"Ethnobotanical study on herbal market at the Dragon Boat Festival of Chuanqing people in China",2021,0,0,0,1,0,0,0,1,0,0,0,0,1,1,0,1,0,0,0,0,0,0,0,1,0,0,0,1,0,2,2
355,"An ethnopharmacological survey and comparative analysis of plants from the Sudhnoti District, Azad Jammu and Kashmir, Pakistan",2021,0,0,0,1,0,0,0,1,0,0,0,1,1,1,0,1,0,0,0,0,0,0,0,1,0,0,0,0,0,2,2
356,"Just beautiful green herbs: use of plants in cultural practices in Bukovina and Roztochya, Western Ukraine",2021,0,0,0,1,0,0,0,1,0,0,0,0,1,0,0,0,0,1,0,0,0,0,0,1,0,1,0,0,0,2,2
357,"Ethnobotanical characterization of medicinal plants used in Kisantu and Mbanza-Ngungu territories, Kongo-Central Province in DR Congo",2021,0,0,0,1,0,0,0,1,0,0,0,0,1,0,0,0,0,0,1,0,0,0,0,1,1,0,0,0,0,3,1
358,"What interferes with conducting free lists? A comparative ethnobotanical experiment",2021,0,0,0,1,0,0,1,1,0,0,0,1,1,0,0,0,0,0,0,0,0,0,0,1,0,1,0,0,1,2,1
359,"Ethnoecology of miriti (Mauritia flexuosa, L.f.) fruit extraction in the Brazilian Amazon: knowledge and practices of riverine peoples contribute to the biodiversity conservation",2021,0,0,0,1,0,0,0,1,0,1,0,1,1,0,0,0,0,1,1,0,0,1,0,0,1,0,0,0,1,3,2
360,"Indigenous biosystematics of yams (Dioscorea spp.) in Southwest Ethiopia: folk taxonomy, ethnolinguistic analysis, and folk descriptors",2021,0,0,0,1,0,0,0,1,1,1,0,0,1,1,0,0,0,0,1,0,0,0,1,1,1,0,1,0,0,3,1
361,"Use patterns, knowledge diversity and drivers for the cultivation of the miracle plant [synsepalum dulcificum (Schumach & Thonn.) Daniell] in Benin and Ghana",2021,0,0,0,1,0,0,0,1,0,0,0,1,0,0,0,0,0,0,1,0,0,0,1,1,0,0,1,0,0,3,1
363,"Methodological advances for hypothesis-driven ethnobiology",2021,0,0,1,1,0,0,1,0,0,1,0,0,0,0,0,0,0,0,0,0,0,0,1,1,0,0,0,0,0,4,1
364,"The food equity and environmental data sovereignty (feeds) project: Protocol for a quasi-experimental study evaluating a digital platform for climate change preparedness",2021,0,0,0,1,0,0,0,0,1,0,0,1,0,1,0,0,0,1,1,1,1,0,0,1,1,0,0,0,0,3,1
365,"Resilient caribbean communities: A long-term perspective on social adaptability to natural hazards, and sustainability in the lesser antilles",2021,0,0,0,1,0,0,1,0,0,0,0,1,0,0,0,0,0,0,1,0,1,0,0,0,1,1,0,0,0,4,1
366,"Compassionate conservation and the challenge of sustainable wildlife management: A survey of the urban public of China",2021,0,0,0,1,0,1,0,1,0,0,0,1,0,0,0,0,0,1,1,0,0,0,1,1,1,0,0,1,0,3,3
367,"Ethnobotanical profiles of wild edible plants recorded from Mongolia by Yunatov during 1940–1951",2021,0,0,0,1,0,0,0,1,0,0,0,1,1,1,1,0,0,0,0,1,0,1,0,1,0,0,0,0,0,2,2
368,"A feature-oriented vehicle trajectory data processing scheme for data mining: A case study for Statewide truck parking behaviors",2021,0,0,0,1,1,0,0,0,0,0,1,1,0,0,0,0,0,0,0,0,0,0,0,1,0,0,0,0,0,4,3
369,"Peasants’ Motivations to Maintain Vegetation of Tropical Dry Forests in Traditional Agroforestry Systems from Cuicatlán, Oaxaca, Mexico",2021,0,0,0,1,0,0,1,1,0,1,0,0,1,1,0,0,1,1,1,0,0,0,0,1,1,1,0,0,1,3,1
370,"Knowledge discovery from healthcare electronic records for sustainable environment",2021,0,0,0,1,1,0,0,0,0,0,1,1,0,1,0,0,0,0,1,0,0,0,0,1,0,0,0,0,0,4,3
371,"Bird diversity and ethno-ornithological knowledge of local people in ciletuh-palabuhanratu geopark, sukabumi, west java, indonesia",2021,0,0,0,1,0,0,1,1,0,1,0,1,0,0,0,0,0,0,1,0,0,0,0,1,1,1,0,1,0,3,1
372,"A mixed-methods approach to elucidate SARS-CoV-2 transmission routes and clustering in outbreaks in native workers and labour migrants in the fruit and vegetable packaging industry in South Holland, the Netherlands, May to July 2020",2021,0,0,0,1,0,0,0,1,0,1,0,0,0,1,0,0,0,0,0,0,0,0,0,1,0,0,0,0,0,2,1
373,"Gender differences in traditional knowledge of useful plants in a Brazilian community",2021,0,0,1,1,0,0,0,1,0,1,0,1,1,0,0,0,0,0,1,0,0,0,0,1,1,0,0,0,1,3,1
374,"Folk classification and traditional uses of cyperus esculentus, a neglected and underutilized species in benin",2021,0,0,0,1,0,0,0,1,1,0,0,1,0,1,0,1,0,0,0,0,0,0,0,1,0,0,0,0,1,2,1
375,"Nuna Nalluyuituq (The Land Remembers): Remembering landscapes and refining methodologies through community-based remote sensing in the Yukon-Kuskokwim Delta, Southwest Alaska",2021,0,1,0,1,0,0,1,1,1,0,0,0,1,1,0,0,0,0,1,0,0,1,1,1,0,1,0,0,0,5,5
376,"Morphological and genetic diversity of traditional varieties of agave in Hidalgo State, Mexico",2021,0,0,0,1,0,0,0,1,0,0,0,0,1,0,0,0,0,1,0,0,0,0,1,1,1,0,0,0,1,3,1
377,"Virtual cultural landscapes: Geospatial visualizations of past environments",2021,0,0,0,1,0,0,1,1,0,0,0,1,0,1,1,0,0,0,0,0,0,0,1,1,1,1,0,0,0,4,2
378,"Cross-cultural and historical traceability of ethnomedicinal Asteraceae. Eastern Morocco and Eastern Andalusia: Two sides of a sea in 20 centuries of history",2021,0,0,0,1,0,0,0,0,0,0,0,0,1,0,0,1,0,0,0,0,0,1,0,1,0,0,0,0,0,2,2
379,"The Power of Phenotype: Toward an Ethnography of Pigmentocracy in Andean Bolivia",2021,0,0,0,1,0,0,1,0,0,0,0,0,0,1,0,0,0,0,0,0,0,0,0,0,0,0,0,0,1,4,1
380,"Caliata: An Indigenous Community in Ecuador Offers Lessons on Food Sovereignty and Sustainable Diets",2021,0,0,0,1,0,0,1,1,1,0,0,0,0,1,0,0,1,1,1,1,0,0,0,1,0,1,0,0,0,3,1
381,"An ethnobotanical study of wild medicinal plants among the mountain community of western himalayas: A case study of govind wildlife sanctuary and national park",2021,0,0,0,1,0,0,0,1,1,0,1,1,1,1,0,1,0,1,1,0,1,0,0,1,0,1,0,1,0,3,1
382,"Erratum to: Market response to syndicated loan announcements from high-profile failed and acquiring banks during the global financial crisis (Accounting & Finance, (2020), 60, 1, (435-470), 10.1111/acfi.12493)",2021,0,0,0,1,1,0,1,1,0,0,1,0,0,1,0,0,0,0,0,0,0,0,0,1,1,0,0,0,0,4,3
383,"Plant species richness at archaeological sites suggests ecological legacy of Indigenous subsistence on the Colorado Plateau",2021,0,0,0,1,0,0,1,0,0,0,0,0,1,1,0,0,0,1,0,0,1,0,0,1,1,0,0,0,0,4,1
384,"Dry Forest Degradation and Traditional Land-Use in the Context of Sustainable Forest Management in Sri Lanka",2021,0,0,0,1,0,0,0,1,0,0,0,1,0,0,0,0,0,1,1,0,0,0,1,0,1,0,0,0,0,3,1
385,"Local wisdom and medicinal plant utilization of certified folk healers for therapeutic purposes in Buriram Province, Thailand",2021,0,0,0,1,0,0,1,1,0,0,0,0,1,0,1,1,0,0,0,0,0,0,0,1,0,0,0,1,0,2,2
386,"Ethno-veterinary practice for the treatment of animal diseases in Neelum Valley, Kashmir Himalaya, Pakistan",2021,0,0,0,1,0,0,0,1,0,0,0,0,1,1,0,1,0,0,0,0,0,1,1,1,0,0,0,1,0,2,2
388,"Are All Foragers the Same? Towards a Classification of Foragers",2021,0,0,0,1,0,0,0,1,0,0,0,1,0,0,0,0,0,0,0,0,0,0,0,0,0,1,0,0,0,2,1
389,"Linking naturalness and quality improvement of monoculture plantations in urban area: A case study in Wuhan city, China",2021,0,0,0,1,0,0,0,1,0,0,1,0,0,1,0,0,0,0,0,0,1,0,0,1,1,0,0,1,0,4,1
390,"Growing (with) muskeg: Oil sands reclamation and healing in Northern Alberta",2021,0,0,0,1,0,0,1,0,0,0,0,0,0,1,0,0,0,0,0,0,0,0,0,0,0,1,0,0,0,4,1
391,"Medicinal plants used to treat “African” diseases by the local communities of Bwambara sub-county in Rukungiri District, Western Uganda",2021,0,0,0,1,0,0,0,1,0,0,0,1,1,1,0,1,0,0,0,0,0,0,0,1,1,0,1,1,1,3,1
392,"Women's Group Empowerment Practices: Knowledge Construction Study at The Liza Mangrove Studio in Pematang Johar Village",2021,0,0,0,0,1,0,1,1,0,0,1,1,0,0,0,0,0,0,0,0,0,0,0,1,0,1,0,0,0,5,3
393,"Sharing Indigenous Foods Through Stories and Recipes",2021,0,0,1,0,0,0,0,1,0,0,0,0,0,1,0,0,0,0,0,1,0,0,0,1,0,0,0,0,0,5,1
394,"Multiple perspectives on a biocultural environment: Landscape ethnoecology in the Brazilian dry forest",2021,0,0,0,1,0,0,1,1,1,0,0,0,0,0,0,0,0,0,0,0,0,1,1,1,1,1,0,0,1,3,1
395,"Gender and age differences in the relationship between calorie, macronutrients intake and growth status of school-aged Aboriginal children at Labu, Negeri Sembilan",2021,0,0,0,1,0,0,0,1,0,0,0,0,0,1,0,0,0,0,0,1,0,0,0,1,0,0,0,0,0,2,2
396,"Design of Discovery Learning Model Biodiversity Integrated to Develop the Scientific Attitude of Student",2021,0,0,0,1,0,0,1,1,0,1,0,0,1,0,0,0,0,1,0,0,0,0,0,1,0,0,0,0,0,2,1
397,"Traditional Food Environment and Factors Affecting Indigenous Food Consumption in Munda Tribal Community of Jharkhand, India",2021,0,0,0,1,0,0,1,1,0,0,0,0,0,1,0,1,0,0,1,1,0,1,0,1,0,1,0,1,0,2,2
398,"Mapping the past: Using ethnography and local spatial knowledge to characterize the Duero River borderlands landscape",2021,0,0,0,1,0,0,1,1,0,0,0,1,0,0,0,0,0,1,0,0,0,1,1,1,1,1,0,0,0,3,1
399,"Traditional medicinal plants used by the Mon people in Myanmar",2021,0,0,0,1,0,0,0,1,0,0,0,1,1,0,0,1,0,1,0,0,0,1,0,1,0,1,0,1,0,2,2
400,"Ethnobotanical survey of medicinal plants in Gaomi, China",2021,0,0,0,1,0,0,0,1,0,1,0,1,1,1,0,0,0,0,1,1,0,0,0,1,1,0,0,1,0,3,2
401,"Ethnoscience analysis of ""lemang bamboo"" Sumatera traditional food",2021,0,0,0,1,0,0,1,1,0,1,0,1,0,1,0,0,0,0,0,0,0,0,1,1,0,0,0,0,0,2,1
402,"Knowledge Big Graph Fusing Ontology with Property Graph: A Case Study of Financial Ownership Network",2021,0,0,1,1,0,0,0,0,0,0,1,1,0,0,0,0,0,0,0,0,0,0,0,1,0,0,0,1,0,4,1
404,"Criteria for use and conservation of trees in pastures based on farmers’ local knowledge in a tropical dry forest zone in Colombia; Criterios de uso y conservación de árboles en potreros basados en el conocimiento local de los ganaderos en una zona de bosque seco tropical en Colombia",2021,0,0,0,1,0,0,0,1,0,0,0,1,0,0,0,0,0,0,1,1,0,0,0,1,1,0,0,0,1,3,2
