"ID","Titulo","Ano","RandomForest","SVM","NeuralNetwork","MachineLearning","DataMining","NLP","Ethnography","Interview","Participatory","Observation","CaseStudy","TraditionalKnowledge","Ethnobotany","Indigenous","CulturalKnowledge","TraditionalPractices","Agroecology","Biodiversity","Conservation","FoodSecurity","ClimateChange","Documentation","SpatialAnalysis","Assessment","Management","Developing","Africa","Asia","LatinAmerica","Cluster_KMeans","Cluster_Hierarquico"
548,"Of people and toads: Local knowledge about amphibians around a protected area in the brazilian atlantic forest; Sobre gente e sapos: Conhecimento local sobre anfíbios dos arredores de uma unidade de conservação na mata atlântica brasileira",2019,0,0,0,1,0,0,0,1,0,0,0,1,0,0,0,0,0,0,1,0,0,0,0,1,1,1,0,0,1,3,1
549,"Stock assessment of prochilodus nigricans (Actinopterygii: Characiformes: Prochilodontidae) using two distinct algorithms, in the context of a small-scale amazonian fishery",2019,0,0,0,1,0,0,1,1,0,0,0,1,0,0,0,0,0,0,1,0,0,1,0,1,0,1,0,0,1,2,1
551,"Qualitative assessment of the potential of innovative development of territories",2019,0,0,0,1,0,0,1,0,0,0,0,0,0,1,0,0,0,0,0,0,0,0,0,1,1,0,0,0,0,4,1
554,"A new quantitative ethnoecological approach to assessing the conservation status of plants: A case study of District Tor Ghar, Pakistan",2019,0,0,0,1,0,0,0,1,0,0,1,0,0,1,0,0,0,0,1,0,0,0,0,1,1,1,0,0,0,4,1
555,"'I still remember your post about buying smokes': A case study of a remote Aboriginal community-controlled health service using Facebook for tobacco control",2019,0,0,0,1,0,0,1,0,0,0,1,0,0,1,0,0,0,0,0,0,0,0,0,1,0,1,0,0,0,4,1
556,"Rate of root decomposition of maize at plots and regions using local land knowledge and technical analysis of soils; Tasa de descomposición de raíces de maíz en parcelas y regiones usando conocimiento local de tierras y análisis técnico de suelos",2019,0,0,0,1,0,0,0,1,0,0,0,0,0,0,0,0,0,0,0,0,0,0,0,1,1,0,0,0,1,2,1
557,"Management of wild edible fungi in the meseta Purépecha Region, Michoacán, México",2019,0,0,0,1,0,0,0,1,0,1,0,1,0,1,0,0,0,0,1,0,0,0,0,1,1,0,0,0,1,3,1
558,"New indices for ethnotoxicological assessment of medicinal plants: Example of Tafilalet region, Morocco",2019,0,0,0,1,0,0,0,1,0,0,0,0,1,0,0,1,0,0,0,0,0,0,0,1,0,0,0,0,0,2,2
560,"The effects of visual art supported inquiry based science activities on 5th grade students' scientific process skills",2019,0,0,0,1,0,0,1,0,0,1,0,1,0,0,0,0,0,0,0,0,0,0,0,1,0,0,0,0,0,4,1
561,"Learning deep transferability for several agricultural classification problems",2019,0,0,1,1,0,0,1,0,0,0,0,1,1,1,0,0,0,0,0,0,0,0,0,0,0,0,0,0,0,4,1
562,"Plants used by the rural community of Bananal, Mato Grosso, Brazil: Aspects of popular knowledge",2019,0,0,0,1,0,0,0,1,0,0,0,0,1,0,0,1,0,1,0,0,0,0,0,1,0,1,0,0,1,2,2
563,"In dialogue with indigenous knowledge: Sharing research to promote empowerment of rural communities in India",2019,0,0,0,0,1,0,0,0,1,0,0,1,0,1,0,0,0,0,0,0,0,0,0,0,1,1,0,1,0,5,3
564,"Health-promoting food pricing policies and decision-making in very remote aboriginal and torres strait islander community stores in Australia",2018,0,0,0,1,0,0,1,1,0,0,0,0,0,1,0,0,0,0,1,1,0,0,0,1,0,1,0,0,0,2,2
565,"Indigenous soil classification in four villages of eastern South Africa",2018,0,0,0,1,0,0,1,1,1,1,0,1,0,1,0,0,0,0,0,0,0,1,1,1,1,1,1,0,0,3,1
566,"Banana and plantain production systems in Benin: Ethnobotanical investigation, varietal diversity, pests, and implications for better production",2018,0,0,0,1,0,0,0,1,0,0,0,1,1,1,0,0,0,0,0,1,0,0,0,1,0,1,1,0,0,2,2
567,"Classification and management of community forests in Indian Eastern Himalayas: implications on ecosystem services, conservation and livelihoods",2018,0,0,0,1,0,0,0,1,0,1,0,1,0,1,0,0,0,1,1,0,0,0,0,1,1,1,0,1,0,3,1
568,"Ethnotaxonomy of sharks from tropical waters of Brazil",2018,0,0,0,1,0,0,0,1,0,0,0,0,0,1,1,0,0,0,1,0,0,0,0,1,1,0,0,0,1,3,2
570,"Cultural, economic, and ecological factors influencing management of wild plants and mushrooms interchanged in Purépecha markets of Mexico",2018,0,0,0,1,0,0,0,1,0,1,0,0,1,0,0,0,0,1,1,0,0,0,1,1,1,1,0,0,1,3,1
572,"Species richness, cultural importance, and prioritization of wild spices for conservation in the Sudano-Guinean zone of Benin (West Africa)",2018,0,0,0,1,0,0,0,1,0,0,0,1,1,1,0,0,0,1,1,0,0,0,0,1,1,0,1,0,0,3,2
573,"Breeders' knowledge on cattle fodder species preference in rangelands of Benin",2018,0,0,0,1,0,0,0,1,0,0,0,1,1,1,0,0,0,0,0,0,0,0,0,1,0,0,0,0,0,2,1
574,"Ethnopharmacological field study of three Q'Eqchi communities in Guatemala",2018,0,0,0,1,0,0,0,1,0,1,0,1,1,0,0,0,0,0,0,0,0,0,0,1,0,0,0,0,0,2,1
575,"Ethnobotany in a coastal environmental protected area: Shifts in plant use in two communities in southern Brazil",2018,0,0,0,1,0,0,1,1,0,0,0,1,1,0,0,0,0,0,1,0,0,0,0,1,1,0,0,0,1,3,1
576,"Lack of consensus about indigenous soil knowledge among wet rice farmers in a Thai-Lao village in Northeast Thailand",2018,0,0,0,1,0,0,0,1,0,0,0,1,0,1,0,0,0,0,0,0,0,0,0,1,1,1,0,1,0,2,1
577,"Murihiku Cultural Water Classification System: enduring partnerships between people, disciplines and knowledge systems",2018,0,0,0,1,0,0,0,1,0,0,0,1,0,1,1,0,0,0,0,0,0,1,1,0,1,0,0,0,0,4,2
578,"Photovoice for mobilizing insights on human well-being in complex social-ecological systems: Case studies from Kenya and South Africa",2018,0,0,1,0,0,0,0,0,1,0,1,1,0,0,1,0,0,0,1,0,0,0,0,0,0,1,1,0,0,5,1
579,"Ethnobotany and territory in Mulluri's pasture (Northern Chile). The teachings of aymara pastoralism; Etnobotánica y territorio en el pastal de Mulluri (Norte de Chile). las enseñanzas del pastoreo aymara",2018,0,0,0,1,0,0,1,1,0,1,0,0,1,0,0,0,0,0,0,0,0,0,1,0,1,0,0,0,0,2,1
580,"Factors Determining the Use and Cultivation of Moringa oleifera Lam. in the Republic of Benin",2018,0,0,0,1,0,0,0,1,0,0,0,0,1,0,0,0,0,0,0,0,0,0,1,1,0,0,0,0,0,2,1
581,"Alien leaf beetles (Coleoptera, Chrysomelidae) of European Russia and some general tendencies of leaf beetle invasions",2018,0,0,0,1,0,0,0,0,0,0,1,0,0,1,0,0,0,0,0,0,0,0,1,1,0,0,0,1,0,4,1
582,"Folk taxonomy and traditional uses of common bean (Phaseolus vulgaris L.) landraces by the sociolinguistic groups in the central region of the Republic of Benin",2018,0,0,0,1,0,0,0,1,1,1,0,1,0,0,0,1,0,0,1,0,0,0,0,1,1,1,1,0,0,3,1
583,"Ethnobotany of dioecious species: Traditional knowledge on dioecious plants in India",2018,0,0,0,0,0,0,0,1,0,0,0,1,1,0,0,1,0,0,1,0,0,0,0,1,1,0,0,1,0,5,1
585,"Medicinal plants: Versatility and concordance of use in the caatinga area, northeastern brazil",2018,0,0,0,1,0,0,0,1,0,0,0,0,1,1,0,0,0,0,0,0,0,0,0,1,0,0,0,0,1,2,1
587,"Evidence of traditionality of Brazilian medicinal plants: The case studies of Stryphnodendron adstringens (Mart.) Coville (barbatimão) barks and Copaifera spp. (copaíba) oleoresin in wound healing",2018,0,0,0,1,0,0,0,0,0,0,1,0,1,1,0,1,0,1,0,0,1,0,0,1,0,0,0,1,1,2,1
588,"Ethnobotanical survey of medicinal plants used by nomadic peoples in the Algerian steppe",2018,0,0,0,1,0,0,0,1,0,0,0,1,1,1,0,1,0,0,0,0,0,0,0,1,0,0,1,0,0,2,2
589,"Ethnobotanical and ethnomedicinal studies in Baluchi tribes: A case study in Mt. Taftan, southeastern Iran",2018,0,0,0,1,0,0,0,1,0,0,1,1,1,1,0,1,0,0,0,0,0,0,1,1,0,1,0,0,0,2,2
591,"Medicinal plants of northern Angola and their anti-inflammatory properties",2018,0,0,0,1,0,0,0,1,0,0,0,0,1,1,0,1,0,0,0,0,0,0,0,1,0,0,1,0,0,2,2
592,"Botanical provenance of traditional medicines from Carpathian mountains at the Ukrainian-Polish border",2018,0,0,0,1,0,0,1,1,0,0,0,0,1,0,0,1,0,1,0,1,0,1,0,0,0,1,0,0,0,2,2
593,"What matters when prioritizing a medicinal plant? A study of local criteria for their differential use",2018,0,0,0,1,0,0,0,1,0,0,0,0,1,0,0,0,0,0,0,0,0,0,0,1,0,1,0,0,1,2,1
594,"Living with dolphins: Local ecological knowledge and perceptions of small cetaceans along the Sindhudurg coastline of Maharashtra, India",2018,0,0,0,1,0,0,0,1,0,0,0,0,0,0,0,0,0,0,0,0,0,0,0,1,0,1,0,1,0,2,1
595,"Folk medicinal plant mixtures: Establishing a protocol for further studies",2018,0,0,1,1,0,0,1,1,0,0,0,0,1,0,0,1,0,1,0,0,0,0,0,1,0,0,0,0,0,2,2
596,"Medicinal plants used for hypertension treatment by folk healers in Songkhla province, Thailand",2018,0,0,0,1,0,0,0,1,0,0,0,0,1,0,1,1,0,0,0,0,1,0,0,1,0,0,0,1,1,2,2
597,"Traditional ecological knowledge-based assessment of threatened woody species and their potential substitutes in the Atakora mountain chain, a threatened hotspot of biodiversity in Northwestern Benin, West Africa",2018,0,0,0,1,0,0,0,1,1,0,0,0,0,0,0,0,0,1,1,0,0,0,0,1,1,0,1,0,0,3,2
598,"The ethnoprimatology of the Maijuna of the Peruvian Amazon and implications for primate conservation",2018,0,0,0,1,0,0,0,1,0,0,0,0,0,1,1,1,0,1,1,0,0,0,0,0,1,0,0,0,1,3,2
599,"Ethnopharmacological implications of quantitative and network analysis for traditional knowledge regarding the medicinal use of animals by indigenous people in Wolchulsan National Park, Korea",2018,0,0,1,1,0,0,0,1,0,1,0,1,0,1,0,1,0,0,1,0,0,1,0,1,1,0,0,0,0,3,2
600,"Morphological diversity of panicle traits in Kam fragrant glutinous rice (Oryza sativa)",2018,0,0,0,1,0,0,1,0,0,0,0,0,1,0,0,0,0,0,1,0,0,0,0,1,1,0,0,1,0,3,2
601,"Bulked gold, riverine trade, hiking trails, and WorldView2 satellite remote sensing in Northwestern Luzon: The Angaqui network",2018,0,0,1,1,0,0,0,1,0,0,1,0,0,1,0,0,0,0,0,0,0,1,1,1,0,1,0,0,0,4,1
602,"‘This is not the jungle, this is my barbecho’: semantics of ethnoecological landscape categories in the Bolivian Amazon",2018,0,0,0,1,0,0,0,1,0,0,1,0,0,1,0,0,0,0,0,0,0,0,1,1,1,0,0,0,1,4,1
603,"Weather-lore associated with religious and folklore holidays in Romania",2018,0,0,0,1,0,0,0,1,0,0,0,1,0,0,1,0,0,0,0,0,0,0,1,1,0,0,0,0,0,2,2
604,"The world practice of development of writing for non-literate cultures",2018,0,0,0,1,0,0,0,0,0,0,0,0,0,1,0,0,0,0,0,0,0,0,0,1,0,0,0,1,0,2,1
606,"Ethnophytonomical study about the pyrenean valley of roncal (Navarre); Estudio etnofitonímico del valle pirenaico de roncal (Navarra)",2018,0,0,0,1,0,0,1,1,0,0,0,0,1,0,0,0,0,0,1,0,0,0,1,1,1,0,0,0,0,3,1
607,"Tide and time: Korean Fishermen's traditional knowledge of Multtae in Gomso Bay",2018,0,0,0,1,0,0,1,0,0,0,0,1,0,1,1,0,0,0,0,0,0,0,0,0,0,1,0,0,0,4,2
608,"Assessing the social, ecological and economic impact on conservation activities within human-modified landscapes: A case study in Jhargram district of West Bengal, India",2018,0,0,0,1,0,0,0,0,0,0,1,0,1,0,0,0,0,1,1,0,0,1,0,1,1,1,0,1,0,3,2
609,"Effects of edaphic and physiognomic factors on species diversity, distribution and composition in reserved forest of Sathan Gali (Mansehra), Pakistan",2018,0,0,0,1,0,0,1,0,0,0,0,0,0,1,0,0,0,1,0,0,0,0,0,1,0,0,0,0,0,4,1
610,"Reimagining invasions: The social and cultural impacts of Prosopis on pastoralists in southern Afar, Ethiopia",2017,0,0,0,1,0,0,0,1,0,0,0,1,0,0,0,0,0,0,1,0,0,0,0,0,0,0,1,0,0,3,1
611,"Medicinal plants profile used by the 3rd District population of Maceió-AL; Perfil de plantas medicinais utilizadas pela população do 3º distrito Sanitário de Maceió-AL",2017,0,0,0,1,0,0,1,1,0,0,0,0,1,0,0,0,0,0,0,0,0,0,0,1,0,0,0,0,1,2,1
612,"Ethnobotanical classification of the medicinal plants used by the population in the municipality of Uruará, Pará state, Brazil; Levantamento etnobotânico de plantas medicinais utilizadas pelos moradores do município de Uruará, Estado do Pará, Brasil; Clasificación etnobotánica de las plantas medicinales utilizadas por los habitantes del municipio de Uruará, estado de Pará, Brasil",2017,0,0,0,1,0,0,0,1,0,0,0,0,1,0,0,0,0,0,0,0,0,0,0,1,0,0,0,0,1,2,1
613,"Social media data analysis in urban e-planning",2017,0,0,1,1,1,0,0,0,1,0,1,1,0,0,0,0,0,0,0,0,0,0,1,1,1,0,0,0,0,4,3
614,"The conservation of native priority medicinal plants in a caatinga area in Ceará, northeastern Brazil",2017,0,0,0,1,0,0,0,1,0,0,0,1,1,1,0,0,0,0,1,0,0,0,0,1,1,0,0,0,1,3,1
615,"Developing a web-based ppgis, as an environmental reporting service",2017,0,0,0,0,1,0,0,0,1,0,1,1,0,0,0,0,0,0,0,0,0,0,1,1,1,1,0,0,0,5,3
616,"Ethnobotanical survey of herbal tea plants from the traditional markets in Chaoshan, China",2017,0,0,0,1,0,0,0,1,0,0,0,0,1,0,0,1,0,0,1,0,0,0,0,1,0,0,0,1,0,2,2
617,"Race, Status, and Biodiversity: The Social Climbing of Quinoa",2017,0,0,0,1,0,0,0,0,0,0,0,1,0,0,0,0,0,1,0,0,0,0,0,0,0,0,0,0,1,4,1
618,"Genetic basis for folk classification of oca (Oxalis tuberosa Molina; Oxalidaceae): implications for research and conservation of clonally propagated crops",2017,0,0,0,1,0,0,0,0,0,0,1,1,1,0,0,0,1,0,1,1,0,0,0,1,1,0,0,0,0,4,1
619,"Native-immigrant occupational segregation and worker health in the United States, 2004–2014",2017,0,0,1,1,0,0,0,1,0,0,0,0,0,1,0,0,0,0,0,0,0,1,0,1,0,0,0,0,0,2,1
621,"Rule-guided human classification of Volunteered Geographic Information",2017,0,0,0,1,1,0,1,0,0,1,0,1,0,0,0,0,0,0,0,0,0,1,1,1,0,1,0,0,0,4,3
622,"Ethnopharmacologic survey of medicinal plants used to treat human diseases by traditional medical practitioners in Dega Damot district, Amhara, Northwestern Ethiopia",2017,0,0,0,1,0,0,0,1,0,1,0,1,1,1,0,1,0,0,1,0,0,0,0,1,1,0,1,0,0,3,2
623,"Comparison of Lamiaceae medicinal uses in eastern Morocco and eastern Andalusia and in Ibn al-Baytar's Compendium of Simple Medicaments (13th century CE)",2017,0,0,0,1,0,0,1,0,0,1,0,1,1,0,0,1,0,0,0,0,0,1,1,1,0,1,0,0,0,2,2
624,"Treatment and management of liver diseases by Khmer traditional healers practicing in Phnom Penh area, Cambodia",2017,0,0,0,1,0,0,0,1,0,0,0,0,1,0,0,1,0,0,0,0,0,0,0,1,1,1,0,1,0,2,2
625,"Naga people’s (Tasikmalaya District, West Java, Indonesia) local knowledge of the variations and traditional management farm of village chickens",2017,0,0,0,1,0,0,1,0,0,0,0,1,0,0,0,0,0,0,1,0,0,0,0,1,1,1,0,1,0,4,1
626,"Economic botany collections: A source of material evidence for exploring historical changes in Chinese medicinal materials",2017,0,0,0,1,0,0,0,0,0,0,1,0,1,0,0,0,0,0,0,0,0,0,0,1,0,0,0,1,0,2,1
627,"Traditional knowledge on wild and cultivated plants in the Kilombero Valley (Morogoro Region, Tanzania)",2017,0,0,0,1,0,0,0,1,0,0,0,1,1,0,0,1,0,0,1,0,0,0,0,1,0,1,1,0,0,2,2
628,"Inventorization of some ayurvedic plants and their ethnomedicinal use in Kakrajhore forest area of West Bengal",2017,0,0,0,1,0,0,0,1,0,0,0,1,1,1,0,1,0,0,1,0,0,1,1,1,1,0,0,1,0,3,2
629,"Descriptive study of plant resources in the context of the ethnomedicinal relevance of indigenous flora: A case study from Toli Peer National Park, Azad Jammu and Kashmir, Pakistan",2017,0,0,0,1,0,0,1,1,0,0,1,0,1,1,0,1,0,0,0,0,0,1,0,1,0,1,0,0,0,2,2
630,"Is the interculturalisation of Chile's universities a real possibility?",2017,0,0,0,1,0,0,0,0,0,0,0,0,0,1,0,0,0,0,0,0,0,0,0,0,1,0,0,0,1,4,1
631,"Exploring local knowledge and preferences for shea (Vitellaria paradoxa) ethnovarieties in Southwest Burkina Faso through a gender and ethnic lens",2017,0,0,0,1,0,0,0,0,1,0,0,1,1,0,0,0,0,0,0,0,0,0,0,1,0,1,1,0,0,2,1
632,"Safeguarding Sacred Sites in the Subarctic Zone – Three Case Studies from Northern Russia",2017,0,0,0,1,0,0,1,0,0,0,1,0,0,1,0,0,0,0,0,0,0,0,1,1,0,1,0,0,0,4,1
633,"A network-based computational model for creative knowledge discovery bridging human-computer interaction and data mining",2017,0,0,1,1,1,0,0,1,0,0,1,1,0,0,0,0,0,0,0,0,0,1,0,1,0,0,0,0,0,4,3
635,"ECO-taxonomic studies of chagharzai valley district buner (Khyber Pakhtunkhwa) Pakistan",2017,0,0,0,1,0,0,0,1,0,0,0,0,1,0,0,0,1,0,0,0,0,0,0,1,0,0,0,0,0,2,1
636,"Anemia and hemoglobin levels among indigenous Xavante children, Central Brazil; Anemia e níveis de hemoglobina em crianças indígenas Xavante, Brasil Central",2017,0,0,0,1,0,0,0,1,0,0,0,0,0,1,0,0,0,0,0,1,0,0,0,0,0,0,0,1,1,2,1
638,"Ethnobotanical survey of medicinal flora in the rural community Rio dos Couros, state of Mato Grosso, Brazil; Estudio etnobotánico de la flora medicinal en la comunidad rural Rio dos Couros, estado de Mato Grosso, Brasil",2017,0,0,0,1,0,0,0,1,0,0,0,1,1,0,0,0,0,0,0,0,0,0,0,1,0,1,0,0,1,2,1
639,"Integrated Monitoring for Biodiversity Using Remote Sensing: From Local to Regional – A Case Study from Norfolk",2017,0,0,0,1,0,0,0,0,0,1,1,1,0,0,0,0,0,1,1,0,0,1,1,1,1,1,0,0,0,3,1
640,"A survey of herbal weeds for treating skin disorders from Southern Thailand: Songkhla and Krabi Province",2016,0,0,0,1,0,0,0,1,0,0,0,1,1,0,0,0,0,0,1,0,0,0,0,1,1,0,0,1,1,3,1
642,"Multiple-factor classification of a human-modified forest landscape in the Hsuehshan Mountain Range, Taiwan",2016,0,0,0,1,0,0,0,1,0,0,0,1,0,1,0,0,0,0,0,0,0,0,0,1,1,0,0,0,0,4,1
643,"Perceived reasons for changes in the use of wild food plants in Saaremaa, Estonia",2016,0,0,0,1,0,0,0,1,0,0,0,0,1,0,0,1,0,0,0,0,0,0,0,0,0,0,0,0,0,2,2
645,"ACM International Conference Proceeding Series",2016,0,0,1,1,0,0,0,0,0,0,1,1,0,1,0,0,0,0,0,0,0,0,0,1,0,1,1,0,0,4,1
646,"Medicinal plant diversity and traditional healing practices in eastern Nepal",2016,0,0,0,1,0,0,0,1,0,0,0,0,1,1,0,1,0,0,1,0,0,0,0,1,1,1,0,1,0,3,2
647,"Ethnobotanical investigation on medicinal plants in the Vesuvio National Park (Campania, Southern Italy)",2016,0,0,0,1,0,0,0,1,0,0,0,0,1,0,0,1,0,1,1,0,0,0,0,1,1,1,0,0,0,3,2
648,"Contributions to the phytotherapies of digestive disorders: Traditional knowledge and cultural drivers of Manoor Valley, Northern Pakistan",2016,0,0,0,1,0,0,0,1,0,0,0,1,1,1,0,1,0,0,1,0,0,0,0,1,0,1,0,0,0,2,2
649,"Historical versus contemporary medicinal plant uses in the US Virgin Islands",2016,0,0,0,1,0,0,0,1,0,1,0,0,1,0,0,1,0,1,1,0,0,1,0,1,0,0,0,0,0,3,2
650,"Possible similarities between the folk medicine historically used by First Nations and American Indians in North America and the ethnoveterinary knowledge currently used in British Columbia, Canada",2016,0,0,0,1,0,0,0,1,0,0,0,0,1,1,0,1,0,0,0,0,0,0,1,1,0,0,0,1,1,2,1
651,"A snail shell process model for knowledge discovery via data analytics",2016,0,0,0,0,1,0,0,0,0,0,1,1,0,0,0,0,0,0,0,0,0,0,0,0,0,0,0,0,0,5,3
652,"Folk knowledge of invertebrates in Central Europe - folk taxonomy, nomenclature, medicinal and other uses, folklore, and nature conservation",2016,0,0,0,1,0,0,0,1,0,0,0,0,0,0,1,1,0,0,1,0,0,0,0,0,1,0,0,0,0,3,2
654,"The local knowledge of the rural people on species, Role and hunting of birds: Case study in Karangwangi Village, West Java, Indonesia",2016,0,0,0,1,0,0,1,0,0,0,1,1,0,0,0,0,0,0,1,0,0,0,0,1,1,1,0,1,0,4,1
655,"Ethnobotanical survey of medicinal plants used as anthelmintic remedies in Gabon",2016,0,0,0,1,0,0,0,1,0,0,0,0,1,0,0,1,0,0,0,0,0,0,0,1,0,1,1,0,1,2,2
656,"Observations on traditional usage of ethnomedicinal plants in humans and animals of Kangra and Chamba districts of Himachal Pradesh in North-Western Himalaya, India",2016,0,0,0,1,0,0,1,1,0,1,0,0,1,0,0,1,0,0,0,0,0,0,0,1,0,0,0,1,0,2,1
657,"The use of wild vertebrates in contemporary Spanish ethnoveterinary medicine",2016,0,0,0,1,0,0,1,0,0,0,0,1,0,1,1,1,0,0,0,0,0,1,0,0,0,0,0,0,1,4,2
658,"Natural remedies used by Bunong people in Mondulkiri province (Northeast Cambodia) with special reference to the treatment of 11 most common ailments",2016,0,0,0,1,0,0,0,1,0,0,0,1,1,1,0,1,0,0,0,0,0,1,0,1,0,1,0,1,0,2,2
659,"Traditional knowledge and use of wild mushrooms by Mixtecs or Ñuu savi, the people of the rain, from Southeastern Mexico",2016,0,0,0,1,0,0,1,1,0,0,0,1,0,1,1,0,0,0,1,0,1,1,0,1,1,1,0,0,1,3,2
660,"Exploiting indigenous knowledge of subsistence farmers' for the management and conservation of Enset (Ensete ventricosum (Welw.) Cheesman) (musaceae family) diversity on-farm",2016,0,0,0,1,0,0,0,1,1,1,0,1,1,1,0,0,0,1,1,0,0,0,0,1,1,0,1,0,0,3,2
661,"To what extent are medicinal plants shared between country home gardens and urban ones? A case study from Misiones, Argentina",2016,0,0,0,1,0,0,0,1,0,0,1,0,1,0,0,1,0,0,0,0,0,0,0,1,0,1,0,0,0,2,2
663,"Angelica sinensis in China-A review of botanical profile, ethnopharmacology, phytochemistry and chemical analysis",2016,0,0,0,1,0,0,1,0,0,0,0,0,1,0,0,1,0,0,0,0,0,1,0,1,0,1,0,1,0,2,2
664,"Patterns in medicinal plant knowledge and use in a Maroon village in Suriname",2016,0,0,0,1,0,0,1,1,0,1,0,1,1,0,0,1,0,0,0,0,0,0,0,1,0,1,0,0,0,2,1
665,"Ethnobotanical note on the veterinary health-care management by Malayali tribes of Kalrayan hills",2016,0,0,0,1,0,0,0,1,0,1,0,1,1,1,0,0,0,0,0,0,0,0,0,1,1,0,0,1,0,3,1
666,"An ethnomedicinal survey of a Tashelhit-speaking community in the High Atlas, Morocco",2016,0,0,0,1,0,0,0,1,0,0,0,1,1,0,0,1,0,0,0,0,0,0,0,1,0,0,1,0,0,2,2
667,"Traditional use of medicinal plants among Kalasha, Ismaeli and Sunni groups in Chitral District, Khyber Pakhtunkhwa province, Pakistan",2016,0,0,0,1,0,0,0,1,0,0,0,1,1,1,1,1,0,0,1,0,0,0,0,1,0,0,0,0,0,2,2
668,"Ethnobotany, Traditional Knowledge, and Diversity of Wild Edible Plants and Fungi: A Case Study in the Bandipora District of Kashmir Himalaya, India",2016,0,0,0,1,0,0,0,1,0,0,1,1,1,0,0,0,0,1,0,0,0,0,0,1,0,1,0,1,1,2,1
669,"How do Artisanal Fishermen Name Fish? An Ethnotaxonomic Study in Northeastern Brazil",2016,0,0,0,1,0,0,0,1,0,0,0,0,0,0,0,0,0,0,1,0,0,0,0,1,1,0,0,0,1,3,1
670,"Prevalence of rheumatic diseases in Raramuri people in Chihuahua, Mexico: a community-based study",2016,0,0,0,1,0,0,0,1,1,0,0,0,0,1,0,0,0,0,0,0,0,0,0,1,0,0,0,1,1,2,1
671,"Prevalence of musculoskeletal disorders and rheumatic diseases in the indigenous Qom population of Rosario, Argentina",2016,0,0,0,1,0,0,0,1,0,0,0,0,0,1,0,1,0,0,0,0,0,0,0,1,0,0,0,1,0,2,2
672,"Medicinal plants at Rio Jauaperi, Brazilian Amazon: Ethnobotanical survey and environmental conservation",2016,0,0,0,1,0,0,1,1,0,1,0,1,1,1,0,1,0,1,1,0,0,1,1,1,1,1,0,0,1,3,2
674,"Medicinal plants of Guinea-Bissau: Therapeutic applications, ethnic diversity and knowledge transfer",2016,0,0,0,1,0,0,0,1,0,1,0,0,1,1,0,1,0,1,0,0,0,1,1,1,0,0,0,0,0,2,2
675,"Exudates used as medicine by the “caboclos river-dwellers” of the Unini River, AM, Brazil – Classification based in their chemical composition",2016,0,0,0,1,0,0,1,1,0,0,0,0,1,0,0,1,0,0,0,0,0,1,1,1,0,0,0,0,1,2,1
676,"Do farmers using conventional and non-conventional systems of agriculture have different perceptions of the diversity of wild birds? Implications for conservation",2016,0,0,0,1,0,0,0,1,0,0,0,0,0,0,0,0,0,0,1,0,0,0,0,1,1,1,0,0,1,3,1
677,"Traditional Arabic Palestinian ethnoveterinary practices in animal health care: A field survey in the West Bank (Palestine)",2016,0,0,0,1,0,0,0,1,0,1,0,0,1,0,0,1,0,0,0,0,0,0,0,1,1,1,0,0,0,2,1
678,"Ethnomedicinal survey of a maroon community in Brazil's Atlantic tropical forest",2016,1,0,0,1,0,0,0,1,0,0,0,0,1,1,0,1,0,1,0,0,0,0,1,1,0,0,1,0,1,1,4
679,"Tenants with additional needs: When housing first does not solve homelessness",2016,0,0,0,1,0,0,0,0,0,0,1,0,0,1,0,0,0,0,0,0,0,0,0,1,1,0,0,0,0,4,1
680,"An ethnobotanical analysis of parasitic plants (Parijibi) in the Nepal Himalaya",2016,0,0,0,1,0,0,0,1,0,0,0,0,1,1,0,1,0,1,1,0,0,1,0,1,1,0,0,1,0,3,2
681,"Wild medicinal and food plants used by communities living in Mopane woodlands of southern Angola: Results of an ethnobotanical field investigation",2016,0,0,0,1,0,0,0,1,0,0,0,0,1,0,0,1,0,0,0,0,0,1,0,1,0,0,1,0,0,2,2
682,"A comparative ethnopharmacological analysis of traditional medicine used against respiratory tract diseases in Mauritius",2016,0,0,0,1,0,0,0,1,0,0,0,1,1,1,0,1,0,0,0,0,0,0,0,1,0,0,0,1,0,2,2
683,"Ethnoichthyology of the indigenous Truká people, Northeast Brazil",2016,0,0,0,1,0,0,0,1,0,0,0,0,0,1,0,1,0,0,1,0,0,0,0,1,1,1,0,0,1,3,1
684,"Traditional ecological knowledge on shifting cultivation and forest management in East Borneo, Indonesia",2016,0,0,0,1,0,0,0,1,1,1,0,1,0,1,0,0,0,0,1,0,0,0,0,1,1,1,0,1,0,3,1
685,"Integrating scientific knowledge, data and stakeholder perceptions for decision support",2016,0,0,0,1,0,0,0,1,0,0,1,1,0,0,0,0,0,0,1,0,1,1,1,1,0,0,0,0,0,4,1
686,"Art in the Time of Colony",2016,0,0,0,1,0,0,1,0,0,0,1,1,0,1,0,0,0,0,0,0,0,0,1,1,0,1,0,1,0,4,1
687,"Comparison of indigenous and scientific knowledge on soil classification among farmers in Imugan, Nueva Vizcaya, Philippines",2016,0,0,0,1,0,0,0,1,1,1,0,1,0,1,0,0,0,0,0,0,0,0,0,1,1,1,0,0,0,3,1
688,"The role of game mammals as bushmeat In the Caatinga, northeast Brazil",2016,0,0,0,1,0,0,0,1,0,0,0,1,0,0,0,1,0,0,1,1,0,0,0,1,1,1,0,0,1,3,2
689,"A classification of threats to traditional ecological knowledge and conservation responses",2016,0,0,0,1,0,0,0,1,0,0,1,1,0,0,0,0,0,1,1,0,0,0,1,0,1,0,0,1,0,3,1
691,"Ethnobotanical survey of medicinal plant species used by communities around Mabira Central Forest Reserve, Uganda",2016,0,0,0,1,0,0,0,1,0,0,0,1,1,1,0,0,0,0,1,0,0,1,0,1,1,1,1,0,0,3,2
692,"Do discrimination, residential school attendance and cultural disruption add to individual-level diabetes risk among Aboriginal people in Canada? Chronic Disease epidemiology",2015,0,0,0,1,0,0,0,1,0,0,0,0,0,1,0,0,0,0,0,0,0,0,0,1,0,0,0,1,0,2,1
693,"The burden of primary headache disorders in Zambia: national estimates from a population-based door-to-door survey",2015,0,0,0,1,0,0,0,1,0,0,0,1,0,0,0,0,0,0,0,0,0,0,0,1,0,1,0,0,0,2,1
694,"An ethnobotany of the Lukomir Highlanders of Bosnia & Herzegovina",2015,0,0,0,1,0,0,1,1,0,0,0,1,1,1,0,1,0,1,1,0,0,0,0,1,1,0,0,0,0,3,1
695,"The uses of Kenyan aloes: An analysis of implications for names, distribution and conservation",2015,0,0,0,1,0,0,0,1,0,1,0,0,1,0,0,0,0,0,1,0,0,0,0,1,1,0,1,0,0,3,1
696,"Classifying diseases and remedies in ethnomedicine and ethnopharmacology",2015,0,0,0,1,0,0,0,0,0,0,0,0,1,1,0,1,0,0,0,0,0,0,0,1,0,0,0,0,0,2,2
697,"Bird naming systems by Akan people in Ghana follow scientific nomenclature with potentials for conservation monitoring",2015,0,0,0,1,0,0,0,1,1,1,0,1,0,1,0,0,0,1,1,0,0,0,0,1,1,0,0,0,0,3,1
698,"Indigenous knowledge and soil management",2015,0,0,0,1,0,0,0,0,0,0,1,1,0,1,0,0,1,0,1,0,0,0,0,1,1,1,1,0,0,4,1
699,"Impact of traditional culture on Camellia reticulata in Yunnan, China",2015,0,0,0,1,0,0,0,1,1,1,0,0,1,0,0,0,0,0,1,0,0,0,0,0,1,1,0,1,0,3,1
700,"Attitudes and use of medicinal plants during pregnancy among women at health care centers in three regions of Mali, West-Africa",2015,0,0,0,1,0,0,0,1,0,0,0,0,1,0,0,0,0,0,1,0,0,0,0,1,0,1,1,0,0,2,2
